[
  {
    "event_id": "ip-game-silkroad-e1",
    "event_type": "BOUNDARY_REGISTERED",
    "aggregate_type": "source_ip",
    "aggregate_id": "ip-game-silkroad",
    "occurred_at": "2026-10-05T09:00:00+08:00",
    "version": 1,
    "summary": "丝路题材游戏《驿路长风》：登记不可变文化要素与禁用范围",
    "payload": {
      "ip_name": "驿路长风",
      "immutable_elements": [
        {
          "element_id": "IE-SR-01",
          "name": "丝路商道驿站网络与多语书信传统",
          "rule": "海外版可替换场景外观，但驿站接力、书信转译的叙事结构不得删除"
        },
        {
          "element_id": "IE-SR-02",
          "name": "宗教性仪式仪轨",
          "rule": "涉及真实宗教仪式的仪轨顺序、朝向与祝祷词须保持尊重性呈现，不得戏谑化"
        }
      ],
      "prohibitions": [
        {
          "prohibition_id": "P-SR-01",
          "statement": "真实宗教性仪式场景不得改造为娱乐化战斗或抽卡关卡"
        },
        {
          "prohibition_id": "P-SR-02",
          "statement": "朝圣终点空间不得替换为商业打卡地标或品牌植入场景"
        }
      ]
    }
  },
  {
    "event_id": "ip-drama-homeward-e1",
    "event_type": "BOUNDARY_REGISTERED",
    "aggregate_type": "source_ip",
    "aggregate_id": "ip-drama-homeward",
    "occurred_at": "2026-10-05T09:05:00+08:00",
    "version": 1,
    "summary": "现实题材短剧《归家长路》：登记不可变文化要素与禁用范围",
    "payload": {
      "ip_name": "归家长路",
      "immutable_elements": [
        {
          "element_id": "IE-DR-01",
          "name": "寻亲回家的叙事主线与结局",
          "rule": "海外版可调整次要人物关系与对白节奏，但主线、时代背景与团圆结局不得改变"
        }
      ],
      "prohibitions": [
        {
          "prohibition_id": "P-DR-01",
          "statement": "不得将寻亲主线改写为浪漫爱情主线"
        },
        {
          "prohibition_id": "P-DR-02",
          "statement": "不得美化或同情化人口贩卖相关人物"
        }
      ]
    }
  },
  {
    "event_id": "ip-museum-cranes-e1",
    "event_type": "BOUNDARY_REGISTERED",
    "aggregate_type": "source_ip",
    "aggregate_id": "ip-museum-cranes",
    "occurred_at": "2026-10-05T09:10:00+08:00",
    "version": 1,
    "summary": "院藏《瑞鹤图》潮玩衍生：登记文物要素与授权边界",
    "payload": {
      "ip_name": "瑞鹤图潮玩衍生",
      "immutable_elements": [
        {
          "element_id": "IE-MU-01",
          "name": "宋徽宗题签与群鹤构图",
          "rule": "题签文字、群鹤二十只的数量与祥云朝向为不可变要素，须完整呈现"
        },
        {
          "element_id": "IE-MU-02",
          "name": "绢本石青设色",
          "rule": "海外版本可调整材质工艺，但核心色彩识别不得反相或污名化处理"
        }
      ],
      "prohibitions": [
        {
          "prohibition_id": "P-MU-01",
          "statement": "不得遮挡、裁切或戏仿题签"
        },
        {
          "prohibition_id": "P-MU-02",
          "statement": "文物高清数字件不得在博物馆授权市场之外使用"
        }
      ]
    }
  },
  {
    "event_id": "grant-game-ip-e1",
    "event_type": "RIGHTS_CLEARED",
    "aggregate_type": "rights_grant",
    "aggregate_id": "grant-game-ip",
    "occurred_at": "2026-10-06T10:00:00+08:00",
    "version": 1,
    "summary": "游戏 IP 方授权：覆盖沙特、马来西亚等市场的主机与移动端",
    "payload": {
      "grant_kind": "ip_holder",
      "granted_by": "驿路长风工作室",
      "markets": [
        "SA",
        "MY",
        "AE"
      ],
      "channels": [
        "console",
        "mobile"
      ],
      "valid_from": "2026-01-01T00:00:00+08:00",
      "valid_until": "2028-01-01T00:00:00+08:00",
      "status": "active"
    }
  },
  {
    "event_id": "grant-drama-ip-e1",
    "event_type": "RIGHTS_CLEARED",
    "aggregate_type": "rights_grant",
    "aggregate_id": "grant-drama-ip",
    "occurred_at": "2026-10-06T10:05:00+08:00",
    "version": 1,
    "summary": "短剧 IP 方授权：美国、韩国流媒体改编",
    "payload": {
      "grant_kind": "ip_holder",
      "granted_by": "归家长路制片有限公司",
      "markets": [
        "US",
        "KR"
      ],
      "channels": [
        "streaming"
      ],
      "valid_from": "2026-09-01T00:00:00+08:00",
      "valid_until": "2028-09-01T00:00:00+08:00",
      "status": "active"
    }
  },
  {
    "event_id": "grant-talent-drama-e1",
    "event_type": "RIGHTS_CLEARED",
    "aggregate_type": "rights_grant",
    "aggregate_id": "grant-talent-drama",
    "occurred_at": "2026-10-06T10:10:00+08:00",
    "version": 1,
    "summary": "主演肖像与配音授权：美韩市场",
    "payload": {
      "grant_kind": "talent",
      "granted_by": "主演经纪人团队",
      "markets": [
        "US",
        "KR"
      ],
      "channels": [
        "streaming"
      ],
      "valid_from": "2026-09-01T00:00:00+08:00",
      "valid_until": "2028-09-01T00:00:00+08:00",
      "status": "active"
    }
  },
  {
    "event_id": "grant-museum-cn-e1",
    "event_type": "RIGHTS_CLEARED",
    "aggregate_type": "rights_grant",
    "aggregate_id": "grant-museum-cn",
    "occurred_at": "2026-10-06T10:15:00+08:00",
    "version": 1,
    "summary": "博物馆授权：瑞鹤图数字件仅限中国大陆市场（跨境授权须另签）",
    "payload": {
      "grant_kind": "museum",
      "granted_by": "某省博物馆 文创授权处",
      "markets": [
        "CN"
      ],
      "channels": [
        "retail",
        "ecommerce"
      ],
      "valid_from": "2026-01-01T00:00:00+08:00",
      "valid_until": "2027-01-01T00:00:00+08:00",
      "status": "active",
      "scope_note": "仅限中国大陆；不得据此外推其他地区的衍生权利"
    }
  },
  {
    "event_id": "grant-toy-ip-e1",
    "event_type": "RIGHTS_CLEARED",
    "aggregate_type": "rights_grant",
    "aggregate_id": "grant-toy-ip",
    "occurred_at": "2026-10-06T10:20:00+08:00",
    "version": 1,
    "summary": "潮玩出品方自有权利：中国与阿联酋",
    "payload": {
      "grant_kind": "ip_holder",
      "granted_by": "瑞鹤潮玩（东莞）有限公司",
      "markets": [
        "CN",
        "AE"
      ],
      "channels": [
        "retail",
        "ecommerce"
      ],
      "valid_from": "2026-09-01T00:00:00+08:00",
      "valid_until": "2028-09-01T00:00:00+08:00",
      "status": "active"
    }
  },
  {
    "event_id": "grant-partner-kr-dub-e1",
    "event_type": "RIGHTS_CLEARED",
    "aggregate_type": "rights_grant",
    "aggregate_id": "grant-partner-kr-dub",
    "occurred_at": "2026-10-06T10:25:00+08:00",
    "version": 1,
    "summary": "韩国合作配音工作室：韩语配音音轨独占授权",
    "payload": {
      "grant_kind": "material",
      "granted_by": "韩声配音工作室（合作方）",
      "markets": [
        "KR"
      ],
      "channels": [
        "streaming"
      ],
      "valid_from": "2026-09-15T00:00:00+08:00",
      "valid_until": "2028-02-01T00:00:00+08:00",
      "status": "active"
    }
  },
  {
    "event_id": "adapt-game-scene-my-e1",
    "event_type": "ADAPTATION_PROPOSED",
    "aggregate_type": "market_adaptation",
    "aggregate_id": "adapt-game-scene-my",
    "occurred_at": "2026-10-08T11:05:00+08:00",
    "version": 1,
    "summary": "马来西亚版：同一关改为驿站对话与物资调配玩法（与沙特版可合法不同）",
    "payload": {
      "change_target": {
        "type": "scene",
        "ref": "scene-0423-仪式战斗关"
      },
      "target_audience": {
        "market": "MY",
        "languages": [
          "ms",
          "en"
        ],
        "rating_intent": "LPF P12",
        "channels": [
          "console",
          "mobile"
        ]
      },
      "triggered_clearances": [
        "ip_holder",
        "cultural_review",
        "rating_board"
      ],
      "proposed_by": "丝路游戏东南亚发行组",
      "change_summary": "以马来本地玩家熟悉的码头驿站对话承载同一叙事节点，玩法为物资调配"
    }
  },
  {
    "event_id": "adapt-drama-relation-us-e1",
    "event_type": "ADAPTATION_PROPOSED",
    "aggregate_type": "market_adaptation",
    "aggregate_id": "adapt-drama-relation-us",
    "occurred_at": "2026-10-08T14:00:00+08:00",
    "version": 1,
    "summary": "美国版：保留国内寻亲叙事主线，重写次要人物关系以贴近当地观众",
    "payload": {
      "change_target": {
        "type": "character_relation",
        "ref": "rel-lead-02-邻里线"
      },
      "target_audience": {
        "market": "US",
        "languages": [
          "en"
        ],
        "rating_intent": "TV-14",
        "channels": [
          "streaming"
        ]
      },
      "triggered_clearances": [
        "ip_holder",
        "talent",
        "cultural_review",
        "rating_board"
      ],
      "proposed_by": "短剧北美译写组",
      "change_summary": "将松散邻里关系改写为寄养家庭支持网络；主线、结局与时代背景不变"
    }
  },
  {
    "event_id": "adapt-drama-relation-kr-e1",
    "event_type": "ADAPTATION_PROPOSED",
    "aggregate_type": "market_adaptation",
    "aggregate_id": "adapt-drama-relation-kr",
    "occurred_at": "2026-10-08T14:05:00+08:00",
    "version": 1,
    "summary": "韩国版：人物关系改写为社区会馆照护网络，韩语配音",
    "payload": {
      "change_target": {
        "type": "character_relation",
        "ref": "rel-lead-02-邻里线"
      },
      "target_audience": {
        "market": "KR",
        "languages": [
          "ko"
        ],
        "rating_intent": "15+",
        "channels": [
          "streaming"
        ]
      },
      "triggered_clearances": [
        "ip_holder",
        "talent",
        "material",
        "cultural_review",
        "rating_board"
      ],
      "proposed_by": "短剧韩国合作组",
      "change_summary": "以韩国会馆文化重写邻里支持线，使用合作工作室配音音轨"
    }
  },
  {
    "event_id": "adapt-toy-design-cn-e1",
    "event_type": "ADAPTATION_PROPOSED",
    "aggregate_type": "market_adaptation",
    "aggregate_id": "adapt-toy-design-cn",
    "occurred_at": "2026-10-08T15:00:00+08:00",
    "version": 1,
    "summary": "国内版潮玩：瑞鹤图立体便签摆件，完整保留题签与群鹤构图",
    "payload": {
      "change_target": {
        "type": "design",
        "ref": "sku-crane-notes-cn"
      },
      "target_audience": {
        "market": "CN",
        "languages": [
          "zh"
        ],
        "channels": [
          "retail",
          "ecommerce"
        ]
      },
      "triggered_clearances": [
        "museum",
        "ip_holder",
        "cultural_review"
      ],
      "proposed_by": "瑞鹤潮玩设计中心",
      "change_summary": "石青绢本色立体便签，题签独立金属件不裁切"
    }
  },
  {
    "event_id": "adapt-toy-design-ae-bad-e1",
    "event_type": "ADAPTATION_PROPOSED",
    "aggregate_type": "market_adaptation",
    "aggregate_id": "adapt-toy-design-ae-bad",
    "occurred_at": "2026-10-08T15:05:00+08:00",
    "version": 1,
    "summary": "越权提案：凭国内授权拟在阿联酋上架同款（博物馆授权仅限 CN）",
    "payload": {
      "change_target": {
        "type": "asset_usage",
        "ref": "sku-crane-notes-cn → AE"
      },
      "target_audience": {
        "market": "AE",
        "languages": [
          "ar",
          "en"
        ],
        "channels": [